Category,ViewPath,Substitutions,en-US*,en-US,"ref=""0""","ref=""1""","ref=""2""","ref=""3""","ref=""4""","ref=""5""","ref=""6""","ref=""7""","ref=""8""","ref=""9""","ref=""10""","ref=""11""","ref=""12""","ref=""13""","ref=""14""","ref=""15"""
<BlockCommentCategoryData>,BTNN_VACM_V1_1_relay_dp4_AnSon\PLC_1 [CPU 1214C AC/DC/Rly]\Program blocks\Main_P1 [OB1]\Block title,,"""Main Program Sweep (Cycle)""","""Main Program Sweep (Cycle)""",,,,,,,,,,,,,,,,
<BlockCommentCategoryData>,BTNN_VACM_V1_1_relay_dp4_AnSon\PLC_1 [CPU 1214C AC/DC/Rly]\Program blocks\1.ANALOG_INPUT [FB1]\Network 7\Network comment,,"// Network này nhận xung từ HMI để BẬT vĩnh viễn chế độ Thủ công.
// Nó chỉ được reset bởi một hành động khác (xem Network Y","// Network này nhận xung từ HMI để BẬT vĩnh viễn chế độ Thủ công.
// Nó chỉ được reset bởi một hành động khác (xem Network Y",,,,,,,,,,,,,,,,
<BlockCommentCategoryData>,BTNN_VACM_V1_1_relay_dp4_AnSon\PLC_1 [CPU 1214C AC/DC/Rly]\Program blocks\7.WEIGHT_PROCESS [FB7]\KL_Bu_Tru,,">0.0 là bù chủ động vào KL_BU, ngược lại sẽ dùng CAN DƯ",">0.0 là bù chủ động vào KL_BU, ngược lại sẽ dùng CAN DƯ",,,,,,,,,,,,,,,,
<AlarmClassDisplayNameCategory>,BTNN_VACM_V1_1_relay_dp4_AnSon\Acknowledgement\AlarmClassData_IDisplayNaming_DisplayName,,A,A,,,,,,,,,,,,,,,,
<AlarmClassDisplayNameCategory>,BTNN_VACM_V1_1_relay_dp4_AnSon\Acknowledgement\ShortName,,A,A,,,,,,,,,,,,,,,,
<BlockCommentCategoryData>,BTNN_VACM_V1_1_relay_dp4_AnSon\PLC_1 [CPU 1214C AC/DC/Rly]\Program blocks\C#3_WD_SILO [DB3]\AG1_KL_RTD,,Ag1 khối lượng rơi tự do,Ag1 khối lượng rơi tự do,,,,,,,,,,,,,,,,
<BlockCommentCategoryData>,BTNN_VACM_V1_1_relay_dp4_AnSon\PLC_1 [CPU 1214C AC/DC/Rly]\Program blocks\C#3_WD_SILO [DB3]\AG1_SS_DUOI,,Ag1 sai số dưới,Ag1 sai số dưới,,,,,,,,,,,,,,,,
<BlockCommentCategoryData>,BTNN_VACM_V1_1_relay_dp4_AnSon\PLC_1 [CPU 1214C AC/DC/Rly]\Program blocks\C#3_WD_SILO [DB3]\AG1_SS_TREN,,Ag1 sai số trên,Ag1 sai số trên,,,,,,,,,,,,,,,,
<BlockCommentCategoryData>,BTNN_VACM_V1_1_relay_dp4_AnSon\PLC_1 [CPU 1214C AC/DC/Rly]\Program blocks\C#3_WD_SILO [DB3]\AG1_TG_OFF_CAN,,Ag1 thời gian đóng cân,Ag1 thời gian đóng cân,,,,,,,,,,,,,,,,
<BlockCommentCategoryData>,BTNN_VACM_V1_1_relay_dp4_AnSon\PLC_1 [CPU 1214C AC/DC/Rly]\Program blocks\C#3_WD_SILO [DB3]\AG1_TG_ON_CAN,,Ag1 thời gian mở cân,Ag1 thời gian mở cân,,,,,,,,,,,,,,,,
<BlockCommentCategoryData>,BTNN_VACM_V1_1_relay_dp4_AnSon\PLC_1 [CPU 1214C AC/DC/Rly]\Program blocks\C#3_WD_SILO [DB3]\AG1_TG_ODC,,Ag1 thời gian tính lượng rơi thêm,Ag1 thời gian tính lượng rơi thêm,,,,,,,,,,,,,,,,
<BlockCommentCategoryData>,BTNN_VACM_V1_1_relay_dp4_AnSon\PLC_1 [CPU 1214C AC/DC/Rly]\Program blocks\C#3_WD_SILO [DB3]\AG2_KL_RTD,,Ag2 khối lượng rơi tự do,Ag2 khối lượng rơi tự do,,,,,,,,,,,,,,,,
<BlockCommentCategoryData>,BTNN_VACM_V1_1_relay_dp4_AnSon\PLC_1 [CPU 1214C AC/DC/Rly]\Program blocks\C#3_WD_SILO [DB3]\AG2_SS_DUOI,,Ag2 sai số dưới,Ag2 sai số dưới,,,,,,,,,,,,,,,,
<BlockCommentCategoryData>,BTNN_VACM_V1_1_relay_dp4_AnSon\PLC_1 [CPU 1214C AC/DC/Rly]\Program blocks\C#3_WD_SILO [DB3]\AG2_SS_TREN,,Ag2 sai số trên,Ag2 sai số trên,,,,,,,,,,,,,,,,
<BlockCommentCategoryData>,BTNN_VACM_V1_1_relay_dp4_AnSon\PLC_1 [CPU 1214C AC/DC/Rly]\Program blocks\C#3_WD_SILO [DB3]\AG2_TG_OFF_CAN,,Ag2 thời gian đóng cân,Ag2 thời gian đóng cân,,,,,,,,,,,,,,,,
<BlockCommentCategoryData>,BTNN_VACM_V1_1_relay_dp4_AnSon\PLC_1 [CPU 1214C AC/DC/Rly]\Program blocks\C#3_WD_SILO [DB3]\AG2_TG_ON_CAN,,Ag2 thời gian mở cân,Ag2 thời gian mở cân,,,,,,,,,,,,,,,,
<BlockCommentCategoryData>,BTNN_VACM_V1_1_relay_dp4_AnSon\PLC_1 [CPU 1214C AC/DC/Rly]\Program blocks\C#3_WD_SILO [DB3]\AG2_TG_ODC,,Ag2 thời gian tính lượng rơi thêm,Ag2 thời gian tính lượng rơi thêm,,,,,,,,,,,,,,,,
<BlockCommentCategoryData>,BTNN_VACM_V1_1_relay_dp4_AnSon\PLC_1 [CPU 1214C AC/DC/Rly]\Program blocks\C#3_WD_SILO [DB3]\AG3_KL_RTD,,Ag3 khối lượng rơi tự do,Ag3 khối lượng rơi tự do,,,,,,,,,,,,,,,,
<BlockCommentCategoryData>,BTNN_VACM_V1_1_relay_dp4_AnSon\PLC_1 [CPU 1214C AC/DC/Rly]\Program blocks\C#3_WD_SILO [DB3]\AG3_SS_DUOI,,Ag3 sai số dưới,Ag3 sai số dưới,,,,,,,,,,,,,,,,
<BlockCommentCategoryData>,BTNN_VACM_V1_1_relay_dp4_AnSon\PLC_1 [CPU 1214C AC/DC/Rly]\Program blocks\C#3_WD_SILO [DB3]\AG3_SS_TREN,,Ag3 sai số trên,Ag3 sai số trên,,,,,,,,,,,,,,,,
<BlockCommentCategoryData>,BTNN_VACM_V1_1_relay_dp4_AnSon\PLC_1 [CPU 1214C AC/DC/Rly]\Program blocks\C#3_WD_SILO [DB3]\AG3_TG_OFF_CAN,,Ag3 thời gian đóng cân,Ag3 thời gian đóng cân,,,,,,,,,,,,,,,,
<BlockCommentCategoryData>,BTNN_VACM_V1_1_relay_dp4_AnSon\PLC_1 [CPU 1214C AC/DC/Rly]\Program blocks\C#3_WD_SILO [DB3]\AG3_TG_ON_CAN,,Ag3 thời gian mở cân,Ag3 thời gian mở cân,,,,,,,,,,,,,,,,
<BlockCommentCategoryData>,BTNN_VACM_V1_1_relay_dp4_AnSon\PLC_1 [CPU 1214C AC/DC/Rly]\Program blocks\C#3_WD_SILO [DB3]\AG3_TG_ODC,,Ag3 thời gian tính lượng rơi thêm,Ag3 thời gian tính lượng rơi thêm,,,,,,,,,,,,,,,,
<BlockCommentCategoryData>,BTNN_VACM_V1_1_relay_dp4_AnSon\PLC_1 [CPU 1214C AC/DC/Rly]\Program blocks\C#3_WD_SILO [DB3]\AG4_KL_RTD,,Ag4 khối lượng rơi tự do,Ag4 khối lượng rơi tự do,,,,,,,,,,,,,,,,
<BlockCommentCategoryData>,BTNN_VACM_V1_1_relay_dp4_AnSon\PLC_1 [CPU 1214C AC/DC/Rly]\Program blocks\C#3_WD_SILO [DB3]\AG4_SS_DUOI,,Ag4 sai số dưới,Ag4 sai số dưới,,,,,,,,,,,,,,,,
<BlockCommentCategoryData>,BTNN_VACM_V1_1_relay_dp4_AnSon\PLC_1 [CPU 1214C AC/DC/Rly]\Program blocks\C#3_WD_SILO [DB3]\AG4_SS_TREN,,Ag4 sai số trên,Ag4 sai số trên,,,,,,,,,,,,,,,,
<BlockCommentCategoryData>,BTNN_VACM_V1_1_relay_dp4_AnSon\PLC_1 [CPU 1214C AC/DC/Rly]\Program blocks\C#3_WD_SILO [DB3]\AG4_TG_OFF_CAN,,Ag4 thời gian đóng cân,Ag4 thời gian đóng cân,,,,,,,,,,,,,,,,
<BlockCommentCategoryData>,BTNN_VACM_V1_1_relay_dp4_AnSon\PLC_1 [CPU 1214C AC/DC/Rly]\Program blocks\C#3_WD_SILO [DB3]\AG4_TG_ON_CAN,,Ag4 thời gian mở cân,Ag4 thời gian mở cân,,,,,,,,,,,,,,,,
<BlockCommentCategoryData>,BTNN_VACM_V1_1_relay_dp4_AnSon\PLC_1 [CPU 1214C AC/DC/Rly]\Program blocks\C#3_WD_SILO [DB3]\AG4_TG_ODC,,Ag4 thời gian tính lượng rơi thêm,Ag4 thời gian tính lượng rơi thêm,,,,,,,,,,,,,,,,
<BlockCommentCategoryData>,BTNN_VACM_V1_1_relay_dp4_AnSon\PLC_1 [CPU 1214C AC/DC/Rly]\Program blocks\C#3_WD_SILO [DB3]\AG5_KL_RTD,,Ag5 khối lượng rơi tự do,Ag5 khối lượng rơi tự do,,,,,,,,,,,,,,,,
<BlockCommentCategoryData>,BTNN_VACM_V1_1_relay_dp4_AnSon\PLC_1 [CPU 1214C AC/DC/Rly]\Program blocks\C#3_WD_SILO [DB3]\AG5_SS_DUOI,,Ag5 sai số dưới,Ag5 sai số dưới,,,,,,,,,,,,,,,,
<BlockCommentCategoryData>,BTNN_VACM_V1_1_relay_dp4_AnSon\PLC_1 [CPU 1214C AC/DC/Rly]\Program blocks\C#3_WD_SILO [DB3]\AG5_SS_TREN,,Ag5 sai số trên,Ag5 sai số trên,,,,,,,,,,,,,,,,
<BlockCommentCategoryData>,BTNN_VACM_V1_1_relay_dp4_AnSon\PLC_1 [CPU 1214C AC/DC/Rly]\Program blocks\C#3_WD_SILO [DB3]\AG5_TG_OFF_CAN,,Ag5 thời gian đóng cân,Ag5 thời gian đóng cân,,,,,,,,,,,,,,,,
<BlockCommentCategoryData>,BTNN_VACM_V1_1_relay_dp4_AnSon\PLC_1 [CPU 1214C AC/DC/Rly]\Program blocks\C#3_WD_SILO [DB3]\AG5_TG_ON_CAN,,Ag5 thời gian mở cân,Ag5 thời gian mở cân,,,,,,,,,,,,,,,,
<BlockCommentCategoryData>,BTNN_VACM_V1_1_relay_dp4_AnSon\PLC_1 [CPU 1214C AC/DC/Rly]\Program blocks\C#3_WD_SILO [DB3]\AG5_TG_ODC,,Ag5 thời gian tính lượng rơi thêm,Ag5 thời gian tính lượng rơi thêm,,,,,,,,,,,,,,,,
<BlockCommentCategoryData>,BTNN_VACM_V1_1_relay_dp4_AnSon\PLC_1 [CPU 1214C AC/DC/Rly]\Program blocks\1.ANALOG_INPUT [FB1]\Network 1\Network title,,ANALOG MODE,ANALOG MODE,,,,,,,,,,,,,,,,
<BlockCommentCategoryData>,BTNN_VACM_V1_1_relay_dp4_AnSon\PLC_1 [CPU 1214C AC/DC/Rly]\Program blocks\C#3_WD_SILO [DB3]\AP1_KL_RTD,,AP1 khối lượng rơi tự do,AP1 khối lượng rơi tự do,,,,,,,,,,,,,,,,
<BlockCommentCategoryData>,BTNN_VACM_V1_1_relay_dp4_AnSon\PLC_1 [CPU 1214C AC/DC/Rly]\Program blocks\C#3_WD_SILO [DB3]\AP1_SS_DUOI,,AP1 sai số dưới,AP1 sai số dưới,,,,,,,,,,,,,,,,
<BlockCommentCategoryData>,BTNN_VACM_V1_1_relay_dp4_AnSon\PLC_1 [CPU 1214C AC/DC/Rly]\Program blocks\C#3_WD_SILO [DB3]\AP1_SS_TREN,,AP1 sai số trên,AP1 sai số trên,,,,,,,,,,,,,,,,
<BlockCommentCategoryData>,BTNN_VACM_V1_1_relay_dp4_AnSon\PLC_1 [CPU 1214C AC/DC/Rly]\Program blocks\C#3_WD_SILO [DB3]\AP1_TG_OFF_CAN,,AP1 thời gian đóng cân,AP1 thời gian đóng cân,,,,,,,,,,,,,,,,
<BlockCommentCategoryData>,BTNN_VACM_V1_1_relay_dp4_AnSon\PLC_1 [CPU 1214C AC/DC/Rly]\Program blocks\C#3_WD_SILO [DB3]\AP1_TG_ON_CAN,,AP1 thời gian mở cân,AP1 thời gian mở cân,,,,,,,,,,,,,,,,
<BlockCommentCategoryData>,BTNN_VACM_V1_1_relay_dp4_AnSon\PLC_1 [CPU 1214C AC/DC/Rly]\Program blocks\C#3_WD_SILO [DB3]\AP1_TG_ODC,,AP1 thời gian tính lượng rơi thêm,AP1 thời gian tính lượng rơi thêm,,,,,,,,,,,,,,,,
<TagCommentCategoryData>,BTNN_VACM_V1_1_relay_dp4_AnSon\PLC_1 [CPU 1214C AC/DC/Rly]\PLC tags\Out_Put [83]\BTN\Comment,,Băng tải ngang,Băng tải ngang,,,,,,,,,,,,,,,,
<BlockCommentCategoryData>,BTNN_VACM_V1_1_relay_dp4_AnSon\PLC_1 [CPU 1214C AC/DC/Rly]\Program blocks\C#1_RB [DB1]\BTN,,Băng tải ngang,Băng tải ngang,,,,,,,,,,,,,,,,
<TagCommentCategoryData>,BTNN_VACM_V1_1_relay_dp4_AnSon\PLC_1 [CPU 1214C AC/DC/Rly]\PLC tags\Out_Put [83]\XA CL1\Comment,,Băng tải xả cốt liệu 1,Băng tải xả cốt liệu 1,,,,,,,,,,,,,,,,
<BlockCommentCategoryData>,BTNN_VACM_V1_1_relay_dp4_AnSon\PLC_1 [CPU 1214C AC/DC/Rly]\Program blocks\C#1_RB [DB1]\XA CL1,,Băng tải xả cốt liệu 1,Băng tải xả cốt liệu 1,,,,,,,,,,,,,,,,
<TagCommentCategoryData>,BTNN_VACM_V1_1_relay_dp4_AnSon\PLC_1 [CPU 1214C AC/DC/Rly]\PLC tags\Out_Put [83]\XA CL2\Comment,,Băng tải xả cốt liệu 2,Băng tải xả cốt liệu 2,,,,,,,,,,,,,,,,
<BlockCommentCategoryData>,BTNN_VACM_V1_1_relay_dp4_AnSon\PLC_1 [CPU 1214C AC/DC/Rly]\Program blocks\C#1_RB [DB1]\XA CL2,,Băng tải xả cốt liệu 2,Băng tải xả cốt liệu 2,,,,,,,,,,,,,,,,
<TagCommentCategoryData>,BTNN_VACM_V1_1_relay_dp4_AnSon\PLC_1 [CPU 1214C AC/DC/Rly]\PLC tags\Out_Put [83]\XA CL3\Comment,,Băng tải xả cốt liệu 3,Băng tải xả cốt liệu 3,,,,,,,,,,,,,,,,
<BlockCommentCategoryData>,BTNN_VACM_V1_1_relay_dp4_AnSon\PLC_1 [CPU 1214C AC/DC/Rly]\Program blocks\C#1_RB [DB1]\XA CL3,,Băng tải xả cốt liệu 3,Băng tải xả cốt liệu 3,,,,,,,,,,,,,,,,
<TagCommentCategoryData>,BTNN_VACM_V1_1_relay_dp4_AnSon\PLC_1 [CPU 1214C AC/DC/Rly]\PLC tags\Out_Put [83]\XA CL4\Comment,,Băng tải xả cốt liệu 4,Băng tải xả cốt liệu 4,,,,,,,,,,,,,,,,
<BlockCommentCategoryData>,BTNN_VACM_V1_1_relay_dp4_AnSon\PLC_1 [CPU 1214C AC/DC/Rly]\Program blocks\C#1_RB [DB1]\XA CL4,,Băng tải xả cốt liệu 4,Băng tải xả cốt liệu 4,,,,,,,,,,,,,,,,
<TagCommentCategoryData>,BTNN_VACM_V1_1_relay_dp4_AnSon\PLC_1 [CPU 1214C AC/DC/Rly]\PLC tags\Out_Put [83]\XA CL5\Comment,,Băng tải xả cốt liệu 5,Băng tải xả cốt liệu 5,,,,,,,,,,,,,,,,
<BlockCommentCategoryData>,BTNN_VACM_V1_1_relay_dp4_AnSon\PLC_1 [CPU 1214C AC/DC/Rly]\Program blocks\C#1_RB [DB1]\XA CL5,,Băng tải xả cốt liệu 5,Băng tải xả cốt liệu 5,,,,,,,,,,,,,,,,
<TagCommentCategoryData>,BTNN_VACM_V1_1_relay_dp4_AnSon\PLC_1 [CPU 1214C AC/DC/Rly]\PLC tags\Out_Put [83]\BTX\Comment,,Băng tải xiên,Băng tải xiên,,,,,,,,,,,,,,,,
<BlockCommentCategoryData>,BTNN_VACM_V1_1_relay_dp4_AnSon\PLC_1 [CPU 1214C AC/DC/Rly]\Program blocks\C#1_RB [DB1]\BTX,,Băng tải xiên,Băng tải xiên,,,,,,,,,,,,,,,,
<BlockCommentCategoryData>,BTNN_VACM_V1_1_relay_dp4_AnSon\PLC_1 [CPU 1214C AC/DC/Rly]\Program blocks\7.WEIGHT_PROCESS [FB7]\FU_OUT,,Báo cân đầy,Báo cân đầy,,,,,,,,,,,,,,,,
<BlockCommentCategoryData>,BTNN_VACM_V1_1_relay_dp4_AnSon\PLC_1 [CPU 1214C AC/DC/Rly]\Program blocks\7.WEIGHT_PROCESS [FB7]\RUN_T/T,,Bật chạy thô tinh sau khi hết thời gian đợi rơi thêm,Bật chạy thô tinh sau khi hết thời gian đợi rơi thêm,,,,,,,,,,,,,,,,
<BlockCommentCategoryData>,BTNN_VACM_V1_1_relay_dp4_AnSon\PLC_1 [CPU 1214C AC/DC/Rly]\Program blocks\7.WEIGHT_PROCESS [FB7]\FU,,Bít nhớ báo cân đầy,Bít nhớ báo cân đầy,,,,,,,,,,,,,,,,
<TagCommentCategoryData>,BTNN_VACM_V1_1_relay_dp4_AnSon\PLC_1 [CPU 1214C AC/DC/Rly]\PLC tags\Out_Put [83]\BOM TUOI NHUA\Comment,,Bổ ssung 1,Bổ ssung 1,,,,,,,,,,,,,,,,
<TagCommentCategoryData>,BTNN_VACM_V1_1_relay_dp4_AnSon\PLC_1 [CPU 1214C AC/DC/Rly]\PLC tags\Out_Put [83]\DAU DOT\Comment,,Bổ ssung 2,Bổ ssung 2,,,,,,,,,,,,,,,,
<TagCommentCategoryData>,BTNN_VACM_V1_1_relay_dp4_AnSon\PLC_1 [CPU 1214C AC/DC/Rly]\PLC tags\Out_Put [83]\VAN XA SBS\Comment,,Bổ ssung 3,Bổ ssung 3,,,,,,,,,,,,,,,,
<TagCommentCategoryData>,BTNN_VACM_V1_1_relay_dp4_AnSon\PLC_1 [CPU 1214C AC/DC/Rly]\PLC tags\Out_Put [83]\RUNG CL1\Comment,,Bổ ssung 4,Bổ ssung 4,,,,,,,,,,,,,,,,
<TagCommentCategoryData>,BTNN_VACM_V1_1_relay_dp4_AnSon\PLC_1 [CPU 1214C AC/DC/Rly]\PLC tags\Out_Put [83]\RUNG CL2\Comment,,Bổ ssung 5,Bổ ssung 5,,,,,,,,,,,,,,,,
<TagCommentCategoryData>,BTNN_VACM_V1_1_relay_dp4_AnSon\PLC_1 [CPU 1214C AC/DC/Rly]\PLC tags\Out_Put [83]\RUNG CL3\Comment,,Bổ ssung 6,Bổ ssung 6,,,,,,,,,,,,,,,,
<TagCommentCategoryData>,BTNN_VACM_V1_1_relay_dp4_AnSon\PLC_1 [CPU 1214C AC/DC/Rly]\PLC tags\Out_Put [83]\NOTE 7\Comment,,Bổ ssung 7,Bổ ssung 7,,,,,,,,,,,,,,,,
<BlockCommentCategoryData>,BTNN_VACM_V1_1_relay_dp4_AnSon\PLC_1 [CPU 1214C AC/DC/Rly]\Program blocks\C#1_RB [DB1]\BOM_TUOI_NHUA,,Bổ sung 1,Bổ sung 1,,,,,,,,,,,,,,,,
<BlockCommentCategoryData>,BTNN_VACM_V1_1_relay_dp4_AnSon\PLC_1 [CPU 1214C AC/DC/Rly]\Program blocks\C#1_RB [DB1]\DAU_DOT,,Bổ sung 2,Bổ sung 2,,,,,,,,,,,,,,,,
<BlockCommentCategoryData>,BTNN_VACM_V1_1_relay_dp4_AnSon\PLC_1 [CPU 1214C AC/DC/Rly]\Program blocks\C#1_RB [DB1]\VAN_PNSBS,,Bổ sung 3,Bổ sung 3,,,,,,,,,,,,,,,,
<BlockCommentCategoryData>,BTNN_VACM_V1_1_relay_dp4_AnSon\PLC_1 [CPU 1214C AC/DC/Rly]\Program blocks\C#1_RB [DB1]\RUNG CL1,,Bổ sung 4,Bổ sung 4,,,,,,,,,,,,,,,,
<BlockCommentCategoryData>,BTNN_VACM_V1_1_relay_dp4_AnSon\PLC_1 [CPU 1214C AC/DC/Rly]\Program blocks\C#1_RB [DB1]\RUNG CL2,,Bổ sung 5,Bổ sung 5,,,,,,,,,,,,,,,,
<BlockCommentCategoryData>,BTNN_VACM_V1_1_relay_dp4_AnSon\PLC_1 [CPU 1214C AC/DC/Rly]\Program blocks\C#1_RB [DB1]\RUNG CL3,,Bổ sung 6,Bổ sung 6,,,,,,,,,,,,,,,,
<BlockCommentCategoryData>,BTNN_VACM_V1_1_relay_dp4_AnSon\PLC_1 [CPU 1214C AC/DC/Rly]\Program blocks\C#1_RB [DB1]\NOTE 7,,Bổ sung 7,Bổ sung 7,,,,,,,,,,,,,,,,
<TagCommentCategoryData>,BTNN_VACM_V1_1_relay_dp4_AnSon\PLC_1 [CPU 1214C AC/DC/Rly]\PLC tags\Out_Put [83]\BOM DAU\Comment,,Bơm dầu DO,Bơm dầu DO,,,,,,,,,,,,,,,,
<BlockCommentCategoryData>,BTNN_VACM_V1_1_relay_dp4_AnSon\PLC_1 [CPU 1214C AC/DC/Rly]\Program blocks\C#1_RB [DB1]\BOM DAU,,Bơm dầu DO,Bơm dầu DO,,,,,,,,,,,,,,,,
<TagCommentCategoryData>,BTNN_VACM_V1_1_relay_dp4_AnSon\PLC_1 [CPU 1214C AC/DC/Rly]\PLC tags\Out_Put [83]\BOM SBS\Comment,,Bơm nạp hạt nhựa SBS,Bơm nạp hạt nhựa SBS,,,,,,,,,,,,,,,,
<BlockCommentCategoryData>,BTNN_VACM_V1_1_relay_dp4_AnSon\PLC_1 [CPU 1214C AC/DC/Rly]\Program blocks\C#1_RB [DB1]\BOM SBS,,Bơm nạp hạt nhựa SBS,Bơm nạp hạt nhựa SBS,,,,,,,,,,,,,,,,
<TagCommentCategoryData>,BTNN_VACM_V1_1_relay_dp4_AnSon\PLC_1 [CPU 1214C AC/DC/Rly]\PLC tags\Out_Put [83]\CAN AP1\Comment,,Bơm nhựa,Bơm nhựa,,,,,,,,,,,,,,,,
<BlockCommentCategoryData>,BTNN_VACM_V1_1_relay_dp4_AnSon\PLC_1 [CPU 1214C AC/DC/Rly]\Program blocks\C#1_RB [DB1]\CAN AP1,,Bơm nhựa,Bơm nhựa,,,,,,,,,,,,,,,,
<TagCommentCategoryData>,BTNN_VACM_V1_1_relay_dp4_AnSon\PLC_1 [CPU 1214C AC/DC/Rly]\PLC tags\Out_Put [83]\BOM NUOC\Comment,,Bơm nước lọc bụi,Bơm nước lọc bụi,,,,,,,,,,,,,,,,
<BlockCommentCategoryData>,BTNN_VACM_V1_1_relay_dp4_AnSon\PLC_1 [CPU 1214C AC/DC/Rly]\Program blocks\C#1_RB [DB1]\BOM NUOC,,Bơm nước lọc bụi,Bơm nước lọc bụi,,,,,,,,,,,,,,,,
<BlockCommentCategoryData>,BTNN_VACM_V1_1_relay_dp4_AnSon\PLC_1 [CPU 1214C AC/DC/Rly]\Program blocks\C#2_WB [DB2]\BUTRU_AGG1,,Bù trừ khối lượng Agg1,Bù trừ khối lượng Agg1,,,,,,,,,,,,,,,,
<BlockCommentCategoryData>,BTNN_VACM_V1_1_relay_dp4_AnSon\PLC_1 [CPU 1214C AC/DC/Rly]\Program blocks\C#2_WB [DB2]\BUTRU_AGG2,,Bù trừ khối lượng Agg2,Bù trừ khối lượng Agg2,,,,,,,,,,,,,,,,
<BlockCommentCategoryData>,BTNN_VACM_V1_1_relay_dp4_AnSon\PLC_1 [CPU 1214C AC/DC/Rly]\Program blocks\C#2_WB [DB2]\BUTRU_AGG3,,Bù trừ khối lượng Agg3,Bù trừ khối lượng Agg3,,,,,,,,,,,,,,,,
<BlockCommentCategoryData>,BTNN_VACM_V1_1_relay_dp4_AnSon\PLC_1 [CPU 1214C AC/DC/Rly]\Program blocks\C#2_WB [DB2]\BUTRU_AGG4,,Bù trừ khối lượng Agg4,Bù trừ khối lượng Agg4,,,,,,,,,,,,,,,,
<BlockCommentCategoryData>,BTNN_VACM_V1_1_relay_dp4_AnSon\PLC_1 [CPU 1214C AC/DC/Rly]\Program blocks\C#2_WB [DB2]\BUTRU_AGG5,,Bù trừ khối lượng Agg5,Bù trừ khối lượng Agg5,,,,,,,,,,,,,,,,
<BlockCommentCategoryData>,BTNN_VACM_V1_1_relay_dp4_AnSon\PLC_1 [CPU 1214C AC/DC/Rly]\Program blocks\C#2_WB [DB2]\BUTRU_AP1,,Bù trừ khối lượng AP1,Bù trừ khối lượng AP1,,,,,,,,,,,,,,,,
<BlockCommentCategoryData>,BTNN_VACM_V1_1_relay_dp4_AnSon\PLC_1 [CPU 1214C AC/DC/Rly]\Program blocks\C#2_WB [DB2]\BUTRU_FD1,,Bù trừ khối lượng FD1,Bù trừ khối lượng FD1,,,,,,,,,,,,,,,,
<BlockCommentCategoryData>,BTNN_VACM_V1_1_relay_dp4_AnSon\PLC_1 [CPU 1214C AC/DC/Rly]\Program blocks\C#2_WB [DB2]\BUTRU_SB1,,Bù trừ khối lượng SBS1,Bù trừ khối lượng SBS1,,,,,,,,,,,,,,,,
<BlockCommentCategoryData>,BTNN_VACM_V1_1_relay_dp4_AnSon\PLC_1 [CPU 1214C AC/DC/Rly]\Program blocks\FCXL_CCD_AGG12345 [FC9]\Network 1\Network comment,,"Các chân PV_IN và chân WR_IN không có tác dụng cho FB6
Mục đích của FB6 là xử lý giá trị cân WE_AG1 để biến nó thành cân có thể cân nhiều thành phần,bằng cách trừ bì thành phần đã cân trước đó
Chú ý tránh nhầm lẫn:
WE_AG1 hay những biến có chữ AG1 chưa chắc là dành cho cân thành phần AGG1 nhé, có thể nó là đang nói đến cái cân (thường có chữ W ở trước, ví dụ WE_AG1 là cái cân AGG nhé)","Các chân PV_IN và chân WR_IN không có tác dụng cho FB6
Mục đích của FB6 là xử lý giá trị cân WE_AG1 để biến nó thành cân có thể cân nhiều thành phần,bằng cách trừ bì thành phần đã cân trước đó
Chú ý tránh nhầm lẫn:
WE_AG1 hay những biến có chữ AG1 chưa chắc là dành cho cân thành phần AGG1 nhé, có thể nó là đang nói đến cái cân (thường có chữ W ở trước, ví dụ WE_AG1 là cái cân AGG nhé)",,,,,,,,,,,,,,,,
<BlockCommentCategoryData>,BTNN_VACM_V1_1_relay_dp4_AnSon\PLC_1 [CPU 1214C AC/DC/Rly]\Program blocks\7.WEIGHT_PROCESS [FB7]\Network 5\Network comment,,"Các điều kiện AUT, MAN1, MAN2 sẽ được ánh xạ trực tiếp qua đầu ra #STA_RUN, nếu một trong các đầu vào này OFF thì đầu ra sẽ:
>> nếu như cân tràn OVER hoặc hết thời gian cân Thô tinh (cân kiểu nhấp nhả) thì đầu ra cũng sẽ OFF
>> vấn giữ đầu ra ON cho đến khi hết thời gian cân Thô Tinh hoặc cân OVER","Các điều kiện AUT, MAN1, MAN2 sẽ được ánh xạ trực tiếp qua đầu ra #STA_RUN, nếu một trong các đầu vào này OFF thì đầu ra sẽ:
>> nếu như cân tràn OVER hoặc hết thời gian cân Thô tinh (cân kiểu nhấp nhả) thì đầu ra cũng sẽ OFF
>> vấn giữ đầu ra ON cho đến khi hết thời gian cân Thô Tinh hoặc cân OVER",,,,,,,,,,,,,,,,
<BlockCommentCategoryData>,BTNN_VACM_V1_1_relay_dp4_AnSon\PLC_1 [CPU 1214C AC/DC/Rly]\Program blocks\1.ANALOG_INPUT [FB1]\Network 3\Network title,,CALIB ZERO,CALIB ZERO,,,,,,,,,,,,,,,,
<BlockCommentCategoryData>,BTNN_VACM_V1_1_relay_dp4_AnSon\PLC_1 [CPU 1214C AC/DC/Rly]\Program blocks\FCCA_CCD_AGG12345 [FC19]\Network 1\Network title,,CAN COT LIEU AGG1,CAN COT LIEU AGG1,,,,,,,,,,,,,,,,
<BlockCommentCategoryData>,BTNN_VACM_V1_1_relay_dp4_AnSon\PLC_1 [CPU 1214C AC/DC/Rly]\Program blocks\FCCA_IND_AGG12345 [FC21]\Network 1\Network title,,CAN COT LIEU AGG1,CAN COT LIEU AGG1,,,,,,,,,,,,,,,,
<BlockCommentCategoryData>,BTNN_VACM_V1_1_relay_dp4_AnSon\PLC_1 [CPU 1214C AC/DC/Rly]\Program blocks\FCCA_CCD_AGG12345 [FC19]\Network 2\Network title,,CAN COT LIEU AGG2,CAN COT LIEU AGG2,,,,,,,,,,,,,,,,
<BlockCommentCategoryData>,BTNN_VACM_V1_1_relay_dp4_AnSon\PLC_1 [CPU 1214C AC/DC/Rly]\Program blocks\FCCA_IND_AGG12345 [FC21]\Network 2\Network title,,CAN COT LIEU AGG2,CAN COT LIEU AGG2,,,,,,,,,,,,,,,,
<BlockCommentCategoryData>,BTNN_VACM_V1_1_relay_dp4_AnSon\PLC_1 [CPU 1214C AC/DC/Rly]\Program blocks\FCCA_CCD_AGG12345 [FC19]\Network 3\Network title,,CAN COT LIEU AGG3,CAN COT LIEU AGG3,,,,,,,,,,,,,,,,
<BlockCommentCategoryData>,BTNN_VACM_V1_1_relay_dp4_AnSon\PLC_1 [CPU 1214C AC/DC/Rly]\Program blocks\FCCA_IND_AGG12345 [FC21]\Network 3\Network title,,CAN COT LIEU AGG3,CAN COT LIEU AGG3,,,,,,,,,,,,,,,,
<BlockCommentCategoryData>,BTNN_VACM_V1_1_relay_dp4_AnSon\PLC_1 [CPU 1214C AC/DC/Rly]\Program blocks\FCCA_CCD_AGG12345 [FC19]\Network 4\Network title,,CAN COT LIEU AGG4,CAN COT LIEU AGG4,,,,,,,,,,,,,,,,
<BlockCommentCategoryData>,BTNN_VACM_V1_1_relay_dp4_AnSon\PLC_1 [CPU 1214C AC/DC/Rly]\Program blocks\FCCA_IND_AGG12345 [FC21]\Network 4\Network title,,CAN COT LIEU AGG4,CAN COT LIEU AGG4,,,,,,,,,,,,,,,,
<BlockCommentCategoryData>,BTNN_VACM_V1_1_relay_dp4_AnSon\PLC_1 [CPU 1214C AC/DC/Rly]\Program blocks\7.WEIGHT_PROCESS [FB7]\Network 10\Network title,,CAN LOGIC,CAN LOGIC,,,,,,,,,,,,,,,,
<BlockCommentCategoryData>,BTNN_VACM_V1_1_relay_dp4_AnSon\PLC_1 [CPU 1214C AC/DC/Rly]\Program blocks\FCCA_CCD_SB1 [FC18]\Network 1\Network title,,CAN PHU GIA 1,CAN PHU GIA 1,,,,,,,,,,,,,,,,
<BlockCommentCategoryData>,BTNN_VACM_V1_1_relay_dp4_AnSon\PLC_1 [CPU 1214C AC/DC/Rly]\Program blocks\C#8_RD_REPORT [DB8]\PVM_AGG1,,Cân tay Cốt liệu 1,Cân tay Cốt liệu 1,,,,,,,,,,,,,,,,
<BlockCommentCategoryData>,BTNN_VACM_V1_1_relay_dp4_AnSon\PLC_1 [CPU 1214C AC/DC/Rly]\Program blocks\C#8_RD_REPORT [DB8]\PVM_AGG2,,Cân tay Cốt liệu 2,Cân tay Cốt liệu 2,,,,,,,,,,,,,,,,
<BlockCommentCategoryData>,BTNN_VACM_V1_1_relay_dp4_AnSon\PLC_1 [CPU 1214C AC/DC/Rly]\Program blocks\C#8_RD_REPORT [DB8]\PVM_AGG3,,Cân tay Cốt liệu 3,Cân tay Cốt liệu 3,,,,,,,,,,,,,,,,
<BlockCommentCategoryData>,BTNN_VACM_V1_1_relay_dp4_AnSon\PLC_1 [CPU 1214C AC/DC/Rly]\Program blocks\C#8_RD_REPORT [DB8]\PVM_AGG4,,Cân tay Cốt liệu 4,Cân tay Cốt liệu 4,,,,,,,,,,,,,,,,
<BlockCommentCategoryData>,BTNN_VACM_V1_1_relay_dp4_AnSon\PLC_1 [CPU 1214C AC/DC/Rly]\Program blocks\C#8_RD_REPORT [DB8]\PVM_AGG5,,Cân tay Cốt liệu 5,Cân tay Cốt liệu 5,,,,,,,,,,,,,,,,
<BlockCommentCategoryData>,BTNN_VACM_V1_1_relay_dp4_AnSon\PLC_1 [CPU 1214C AC/DC/Rly]\Program blocks\C#8_RD_REPORT [DB8]\PVM_FD1,,Cân tay F/D 1,Cân tay F/D 1,,,,,,,,,,,,,,,,
<BlockCommentCategoryData>,BTNN_VACM_V1_1_relay_dp4_AnSon\PLC_1 [CPU 1214C AC/DC/Rly]\Program blocks\C#8_RD_REPORT [DB8]\PVM_AP1,,Cân tay Nhựa 1,Cân tay Nhựa 1,,,,,,,,,,,,,,,,
<BlockCommentCategoryData>,BTNN_VACM_V1_1_relay_dp4_AnSon\PLC_1 [CPU 1214C AC/DC/Rly]\Program blocks\C#8_RD_REPORT [DB8]\PVM_SB1,,Cân tay SBS 1,Cân tay SBS 1,,,,,,,,,,,,,,,,
<BlockCommentCategoryData>,BTNN_VACM_V1_1_relay_dp4_AnSon\PLC_1 [CPU 1214C AC/DC/Rly]\Program blocks\7.WEIGHT_PROCESS [FB7]\Network 9\Network title,,CAN THO TINH,CAN THO TINH,,,,,,,,,,,,,,,,
<BlockCommentCategoryData>,BTNN_VACM_V1_1_relay_dp4_AnSon\PLC_1 [CPU 1214C AC/DC/Rly]\Program blocks\FCCA_CCD_FD1 [FC12]\Network 1\Network title,,CAN XI MANG 1,CAN XI MANG 1,,,,,,,,,,,,,,,,
<BlockCommentCategoryData>,BTNN_VACM_V1_1_relay_dp4_AnSon\PLC_1 [CPU 1214C AC/DC/Rly]\Program blocks\Main_P1 [OB1]\Network 19\Network title,,CHẾ ĐỘ XẢ LIỆU,CHẾ ĐỘ XẢ LIỆU,,,,,,,,,,,,,,,,
<BlockCommentCategoryData>,BTNN_VACM_V1_1_relay_dp4_AnSon\PLC_1 [CPU 1214C AC/DC/Rly]\Program blocks\7.WEIGHT_PROCESS [FB7]\Network 4\Network title,,CHIA PV,CHIA PV,,,,,,,,,,,,,,,,
<BlockCommentCategoryData>,BTNN_VACM_V1_1_relay_dp4_AnSon\PLC_1 [CPU 1214C AC/DC/Rly]\Program blocks\7.WEIGHT_PROCESS [FB7]\Block comment,,"Chú ý:
W_DU: nhập khối lượng giớ hạn dưới để tính SS_DUOI sai số dưới, ví dụ SV_IN cài là 1000kg, giới hạn dưới cài là W_DU=55kg, vì KL_BU=0.0 nên> SS_DUOI=1000-55=945kg
W_RTD: cài đặt khối lượng rơi tự do, từ đó tính điểm cắt Rơi tự do, ví dụ W_RTD=95kg, khi đó điểm cắt Rơi tự do KL_RTD=1000-95=905kg
Thực tế khi đó: cân sẽ được cân thô đến điểm cắt RTD là 905kg thì nó sẽ bắt đầu chuyển sang Cân Tinh,","Chú ý:
W_DU: nhập khối lượng giớ hạn dưới để tính SS_DUOI sai số dưới, ví dụ SV_IN cài là 1000kg, giới hạn dưới cài là W_DU=55kg, vì KL_BU=0.0 nên> SS_DUOI=1000-55=945kg
W_RTD: cài đặt khối lượng rơi tự do, từ đó tính điểm cắt Rơi tự do, ví dụ W_RTD=95kg, khi đó điểm cắt Rơi tự do KL_RTD=1000-95=905kg
Thực tế khi đó: cân sẽ được cân thô đến điểm cắt RTD là 905kg thì nó sẽ bắt đầu chuyển sang Cân Tinh,",,,,,,,,,,,,,,,,
