<BlockCommentCategoryData>,BTNN_VACM_V1_1_relay_dp4_AnSon\PLC_1 [CPU 1214C AC/DC/Rly]\Program blocks\2.MANUAL_CONTROL [FB2]\Block comment,,"Chức năng của FB: xác định phương thức tác động khi nhấn nút NN1, NN2, NN3 theo 2 cách
Cách 1: MODE = 0, thực hiện như một Toggle, mỗi lần nhấn sẽ đổi trạng thái OUT, từ OFF sang ON và ngược lại.
NN là nút nhấn trên HMI/SCADA
OUT là ngõ ra cần được SET hoặc RESET
ST chính là OUT (nó như là phản hồi để biết OUT đang được SET hay RESET
RS là tín hiệu để reset ngõ ra
Nó dùng M là một biến Static để lưu số lần nhấn nút (ban đầu nếu chưa có ngõ ra OUT, thì M là 0, nhưng khi đã có OUT thì M  là 1), từ đây nếu NN nhấn mà chưa có OUT thì OUT11 sẽ được SET, còn nếu NN được nhấn mà có OUT11 thì sẽ Reset OUT11 đi)
Cách 2: MODE=1, nó thực hiện như một nút nhấn mình thường dạng Momentory, nghĩa là Nhấn thì đầu ra sẽ có, còn nhả ra thì mất OUT.","Chức năng của FB: xác định phương thức tác động khi nhấn nút NN1, NN2, NN3 theo 2 cách
Cách 1: MODE = 0, thực hiện như một Toggle, mỗi lần nhấn sẽ đổi trạng thái OUT, từ OFF sang ON và ngược lại.
NN là nút nhấn trên HMI/SCADA
OUT là ngõ ra cần được SET hoặc RESET
ST chính là OUT (nó như là phản hồi để biết OUT đang được SET hay RESET
RS là tín hiệu để reset ngõ ra
Nó dùng M là một biến Static để lưu số lần nhấn nút (ban đầu nếu chưa có ngõ ra OUT, thì M là 0, nhưng khi đã có OUT thì M  là 1), từ đây nếu NN nhấn mà chưa có OUT thì OUT11 sẽ được SET, còn nếu NN được nhấn mà có OUT11 thì sẽ Reset OUT11 đi)
Cách 2: MODE=1, nó thực hiện như một nút nhấn mình thường dạng Momentory, nghĩa là Nhấn thì đầu ra sẽ có, còn nhả ra thì mất OUT.",,,,,,,,,,,,,,,,
<BlockCommentCategoryData>,BTNN_VACM_V1_1_relay_dp4_AnSon\PLC_1 [CPU 1214C AC/DC/Rly]\Program blocks\C#2_WB [DB2]\SW_XA CL1,,Công tắc Băng tải xả cốt liệu 1,Công tắc Băng tải xả cốt liệu 1,,,,,,,,,,,,,,,,
<BlockCommentCategoryData>,BTNN_VACM_V1_1_relay_dp4_AnSon\PLC_1 [CPU 1214C AC/DC/Rly]\Program blocks\C#2_WB [DB2]\SW_XA CL2,,Công tắc Băng tải xả cốt liệu 2,Công tắc Băng tải xả cốt liệu 2,,,,,,,,,,,,,,,,
<BlockCommentCategoryData>,BTNN_VACM_V1_1_relay_dp4_AnSon\PLC_1 [CPU 1214C AC/DC/Rly]\Program blocks\C#2_WB [DB2]\SW_XA CL3,,Công tắc Băng tải xả cốt liệu 3,Công tắc Băng tải xả cốt liệu 3,,,,,,,,,,,,,,,,
<BlockCommentCategoryData>,BTNN_VACM_V1_1_relay_dp4_AnSon\PLC_1 [CPU 1214C AC/DC/Rly]\Program blocks\C#2_WB [DB2]\SW_XA CL4,,Công tắc Băng tải xả cốt liệu 4,Công tắc Băng tải xả cốt liệu 4,,,,,,,,,,,,,,,,
<BlockCommentCategoryData>,BTNN_VACM_V1_1_relay_dp4_AnSon\PLC_1 [CPU 1214C AC/DC/Rly]\Program blocks\C#2_WB [DB2]\SW_XA CL5,,Công tắc Băng tải xả cốt liệu 5,Công tắc Băng tải xả cốt liệu 5,,,,,,,,,,,,,,,,
<BlockCommentCategoryData>,BTNN_VACM_V1_1_relay_dp4_AnSon\PLC_1 [CPU 1214C AC/DC/Rly]\Program blocks\C#2_WB [DB2]\SW_MAN/AUTO,,Công tắc chế độ chạy tay/tự động,Công tắc chế độ chạy tay/tự động,,,,,,,,,,,,,,,,
<BlockCommentCategoryData>,BTNN_VACM_V1_1_relay_dp4_AnSon\PLC_1 [CPU 1214C AC/DC/Rly]\Program blocks\C#2_WB [DB2]\SW_XA_NOI_TRON,,Công tắc chế độ xả bê tông,Công tắc chế độ xả bê tông,,,,,,,,,,,,,,,,
<BlockCommentCategoryData>,BTNN_VACM_V1_1_relay_dp4_AnSon\PLC_1 [CPU 1214C AC/DC/Rly]\Program blocks\C#2_WB [DB2]\SW_XA_LIEU,,Công tắc chế độ xả cân cốt liệu,Công tắc chế độ xả cân cốt liệu,,,,,,,,,,,,,,,,
<BlockCommentCategoryData>,BTNN_VACM_V1_1_relay_dp4_AnSon\PLC_1 [CPU 1214C AC/DC/Rly]\Program blocks\C#2_WB [DB2]\SW_NAP_NOI_TRON,,Công tắc nạp liệu nồi trộn,Công tắc nạp liệu nồi trộn,,,,,,,,,,,,,,,,
<BlockCommentCategoryData>,BTNN_VACM_V1_1_relay_dp4_AnSon\PLC_1 [CPU 1214C AC/DC/Rly]\Program blocks\C#2_WB [DB2]\SW_PA_AG1,,Công tắc Tạm dừng cân AG1,Công tắc Tạm dừng cân AG1,,,,,,,,,,,,,,,,
<BlockCommentCategoryData>,BTNN_VACM_V1_1_relay_dp4_AnSon\PLC_1 [CPU 1214C AC/DC/Rly]\Program blocks\C#2_WB [DB2]\SW_PA_AG2,,Công tắc Tạm dừng cân AG2,Công tắc Tạm dừng cân AG2,,,,,,,,,,,,,,,,
<BlockCommentCategoryData>,BTNN_VACM_V1_1_relay_dp4_AnSon\PLC_1 [CPU 1214C AC/DC/Rly]\Program blocks\C#2_WB [DB2]\SW_PA_AG3,,Công tắc Tạm dừng cân AG3,Công tắc Tạm dừng cân AG3,,,,,,,,,,,,,,,,
<BlockCommentCategoryData>,BTNN_VACM_V1_1_relay_dp4_AnSon\PLC_1 [CPU 1214C AC/DC/Rly]\Program blocks\C#2_WB [DB2]\SW_PA_AG4,,Công tắc Tạm dừng cân AG4,Công tắc Tạm dừng cân AG4,,,,,,,,,,,,,,,,
<BlockCommentCategoryData>,BTNN_VACM_V1_1_relay_dp4_AnSon\PLC_1 [CPU 1214C AC/DC/Rly]\Program blocks\C#2_WB [DB2]\SW_PA_AG5,,Công tắc Tạm dừng cân AG5,Công tắc Tạm dừng cân AG5,,,,,,,,,,,,,,,,
<BlockCommentCategoryData>,BTNN_VACM_V1_1_relay_dp4_AnSon\PLC_1 [CPU 1214C AC/DC/Rly]\Program blocks\C#2_WB [DB2]\SW_PA_AP1,,Công tắc Tạm dừng cân AP1,Công tắc Tạm dừng cân AP1,,,,,,,,,,,,,,,,
<BlockCommentCategoryData>,BTNN_VACM_V1_1_relay_dp4_AnSon\PLC_1 [CPU 1214C AC/DC/Rly]\Program blocks\C#2_WB [DB2]\SW_PA_FD1,,Công tắc Tạm dừng cân FD1,Công tắc Tạm dừng cân FD1,,,,,,,,,,,,,,,,
<BlockCommentCategoryData>,BTNN_VACM_V1_1_relay_dp4_AnSon\PLC_1 [CPU 1214C AC/DC/Rly]\Program blocks\C#2_WB [DB2]\SW_PA_SB1,,Công tắc Tạm dừng cân SBS1,Công tắc Tạm dừng cân SBS1,,,,,,,,,,,,,,,,
<BlockCommentCategoryData>,BTNN_VACM_V1_1_relay_dp4_AnSon\PLC_1 [CPU 1214C AC/DC/Rly]\Program blocks\C#2_WB [DB2]\SW_XA W_AG1,,Công tắc Van xả cân AG1,Công tắc Van xả cân AG1,,,,,,,,,,,,,,,,
<BlockCommentCategoryData>,BTNN_VACM_V1_1_relay_dp4_AnSon\PLC_1 [CPU 1214C AC/DC/Rly]\Program blocks\C#2_WB [DB2]\SW_XA W_AP1,,Công tắc Van xả cân AP1,Công tắc Van xả cân AP1,,,,,,,,,,,,,,,,
<BlockCommentCategoryData>,BTNN_VACM_V1_1_relay_dp4_AnSon\PLC_1 [CPU 1214C AC/DC/Rly]\Program blocks\C#2_WB [DB2]\SW_XA W_FD1,,Công tắc Van xả cân FD1,Công tắc Van xả cân FD1,,,,,,,,,,,,,,,,
<BlockCommentCategoryData>,BTNN_VACM_V1_1_relay_dp4_AnSon\PLC_1 [CPU 1214C AC/DC/Rly]\Program blocks\C#2_WB [DB2]\SW_XA W_SB1,,Công tắc Van xả cân SB1,Công tắc Van xả cân SB1,,,,,,,,,,,,,,,,
<BlockCommentCategoryData>,BTNN_VACM_V1_1_relay_dp4_AnSon\PLC_1 [CPU 1214C AC/DC/Rly]\Program blocks\Main_P1 [OB1]\Network 4\Network title,,CONVERT ANALOG IN PUT (0.0/ 0-10V: 1.0/4-20mA: 2.0/0-20mA),CONVERT ANALOG IN PUT (0.0/ 0-10V: 1.0/4-20mA: 2.0/0-20mA),,,,,,,,,,,,,,,,
<BlockCommentCategoryData>,BTNN_VACM_V1_1_relay_dp4_AnSon\PLC_1 [CPU 1214C AC/DC/Rly]\Program blocks\Main_P1 [OB1]\Network 5\Network title,,CONVERT ANALOG IN PUT (0.0/ 0-10V: 1.0/4-20mA: 2.0/0-20mA) - Mode Độc Lập,CONVERT ANALOG IN PUT (0.0/ 0-10V: 1.0/4-20mA: 2.0/0-20mA) - Mode Độc Lập,,,,,,,,,,,,,,,,
<BlockCommentCategoryData>,BTNN_VACM_V1_1_relay_dp4_AnSon\PLC_1 [CPU 1214C AC/DC/Rly]\Program blocks\7.WEIGHT_PROCESS [FB7]\Network 11\Network title,,CUA THO TINH,CUA THO TINH,,,,,,,,,,,,,,,,
<BlockCommentCategoryData>,BTNN_VACM_V1_1_relay_dp4_AnSon\PLC_1 [CPU 1214C AC/DC/Rly]\Program blocks\Main_P1 [OB1]\Network 7\Network title,,DATA SIMULATION,DATA SIMULATION,,,,,,,,,,,,,,,,
<BlockCommentCategoryData>,BTNN_VACM_V1_1_relay_dp4_AnSon\PLC_1 [CPU 1214C AC/DC/Rly]\Program blocks\FCCA_CCD_AP1 [FC16]\Network 1\Network comment,,"Đầu tiên nó sẽ đợi một khoảng thời gian gọi là Thời gian trễ cân, sau đó nó mới đủ điều kiện để cân","Đầu tiên nó sẽ đợi một khoảng thời gian gọi là Thời gian trễ cân, sau đó nó mới đủ điều kiện để cân",,,,,,,,,,,,,,,,
<BlockCommentCategoryData>,BTNN_VACM_V1_1_relay_dp4_AnSon\PLC_1 [CPU 1214C AC/DC/Rly]\Program blocks\7.WEIGHT_PROCESS [FB7]\Network 7\Network title,,DELAY BAO DAY,DELAY BAO DAY,,,,,,,,,,,,,,,,
<BlockCommentCategoryData>,BTNN_VACM_V1_1_relay_dp4_AnSon\PLC_1 [CPU 1214C AC/DC/Rly]\Program blocks\7.WEIGHT_PROCESS [FB7]\Network 6\Network title,,DELAY BAO RONG,DELAY BAO RONG,,,,,,,,,,,,,,,,
<BlockCommentCategoryData>,BTNN_VACM_V1_1_relay_dp4_AnSon\PLC_1 [CPU 1214C AC/DC/Rly]\Program blocks\7.WEIGHT_PROCESS [FB7]\Network 8\Network title,,DELAY TINH LUONG ROI THEM,DELAY TINH LUONG ROI THEM,,,,,,,,,,,,,,,,
<BlockCommentCategoryData>,BTNN_VACM_V1_1_relay_dp4_AnSon\PLC_1 [CPU 1214C AC/DC/Rly]\Program blocks\7.WEIGHT_PROCESS [FB7]\T_DLFULL,,Đếm thời gian báo đầy,Đếm thời gian báo đầy,,,,,,,,,,,,,,,,
<BlockCommentCategoryData>,BTNN_VACM_V1_1_relay_dp4_AnSon\PLC_1 [CPU 1214C AC/DC/Rly]\Program blocks\7.WEIGHT_PROCESS [FB7]\T_DLT/T,,Đếm thời gian cho lượng rơi thêm,Đếm thời gian cho lượng rơi thêm,,,,,,,,,,,,,,,,
<BlockCommentCategoryData>,BTNN_VACM_V1_1_relay_dp4_AnSon\PLC_1 [CPU 1214C AC/DC/Rly]\Program blocks\7.WEIGHT_PROCESS [FB7]\KL RTD,,Điểm cắt Rơi tự do,Điểm cắt Rơi tự do,,,,,,,,,,,,,,,,
<BlockCommentCategoryData>,BTNN_VACM_V1_1_relay_dp4_AnSon\PLC_1 [CPU 1214C AC/DC/Rly]\Program blocks\Main_P1 [OB1]\Network 3\Network title,,ĐIỀU KHIỂN TAY,ĐIỀU KHIỂN TAY,,,,,,,,,,,,,,,,
<BlockCommentCategoryData>,BTNN_VACM_V1_1_relay_dp4_AnSon\PLC_1 [CPU 1214C AC/DC/Rly]\Program blocks\C#6_WD_CALIB [DB6]\KLT_AG1,,Đọc khối lượng cân AG,Đọc khối lượng cân AG,,,,,,,,,,,,,,,,
<BlockCommentCategoryData>,BTNN_VACM_V1_1_relay_dp4_AnSon\PLC_1 [CPU 1214C AC/DC/Rly]\Program blocks\C#6_WD_CALIB [DB6]\KLT_AP1,,Đọc khối lượng cân AP,Đọc khối lượng cân AP,,,,,,,,,,,,,,,,
<BlockCommentCategoryData>,BTNN_VACM_V1_1_relay_dp4_AnSon\PLC_1 [CPU 1214C AC/DC/Rly]\Program blocks\C#6_WD_CALIB [DB6]\KLT_FD1,,Đọc khối lượng cân FD,Đọc khối lượng cân FD,,,,,,,,,,,,,,,,
<BlockCommentCategoryData>,BTNN_VACM_V1_1_relay_dp4_AnSon\PLC_1 [CPU 1214C AC/DC/Rly]\Program blocks\C#6_WD_CALIB [DB6]\KLT_SB1,,Đọc khối lượng cân SBS,Đọc khối lượng cân SBS,,,,,,,,,,,,,,,,
<BlockCommentCategoryData>,BTNN_VACM_V1_1_relay_dp4_AnSon\PLC_1 [CPU 1214C AC/DC/Rly]\Program blocks\C#6_WD_CALIB [DB6]\NDT_AG,,Đọc nhiệt độ cốt liệu,Đọc nhiệt độ cốt liệu,,,,,,,,,,,,,,,,
<BlockCommentCategoryData>,BTNN_VACM_V1_1_relay_dp4_AnSon\PLC_1 [CPU 1214C AC/DC/Rly]\Program blocks\C#6_WD_CALIB [DB6]\NDT_AP,,Đọc nhiệt độ nhựa,Đọc nhiệt độ nhựa,,,,,,,,,,,,,,,,
<BlockCommentCategoryData>,BTNN_VACM_V1_1_relay_dp4_AnSon\PLC_1 [CPU 1214C AC/DC/Rly]\Program blocks\C#6_WD_CALIB [DB6]\NDT_TS,,Đọc nhiệt độ tan sấy,Đọc nhiệt độ tan sấy,,,,,,,,,,,,,,,,
<BlockCommentCategoryData>,BTNN_VACM_V1_1_relay_dp4_AnSon\PLC_1 [CPU 1214C AC/DC/Rly]\Program blocks\C#6_WD_CALIB [DB6]\NDT_TL,,Đọc nhiệt độ túi lọc bụi,Đọc nhiệt độ túi lọc bụi,,,,,,,,,,,,,,,,
<BlockCommentCategoryData>,BTNN_VACM_V1_1_relay_dp4_AnSon\PLC_1 [CPU 1214C AC/DC/Rly]\Program blocks\C#6_WD_CALIB [DB6]\XUNG_AG1,,Đọc xung AG1,Đọc xung AG1,,,,,,,,,,,,,,,,
<BlockCommentCategoryData>,BTNN_VACM_V1_1_relay_dp4_AnSon\PLC_1 [CPU 1214C AC/DC/Rly]\Program blocks\C#6_WD_CALIB [DB6]\XUNG_AP1,,Đọc xung AP1,Đọc xung AP1,,,,,,,,,,,,,,,,
<BlockCommentCategoryData>,BTNN_VACM_V1_1_relay_dp4_AnSon\PLC_1 [CPU 1214C AC/DC/Rly]\Program blocks\C#6_WD_CALIB [DB6]\XUNG_FD1,,Đọc xung FD1,Đọc xung FD1,,,,,,,,,,,,,,,,
<BlockCommentCategoryData>,BTNN_VACM_V1_1_relay_dp4_AnSon\PLC_1 [CPU 1214C AC/DC/Rly]\Program blocks\C#6_WD_CALIB [DB6]\XUNG_TEMP_AG,,Đọc xung nhiệt độ AGG,Đọc xung nhiệt độ AGG,,,,,,,,,,,,,,,,
<BlockCommentCategoryData>,BTNN_VACM_V1_1_relay_dp4_AnSon\PLC_1 [CPU 1214C AC/DC/Rly]\Program blocks\C#6_WD_CALIB [DB6]\XUNG_TEMP_AP,,Đọc xung nhiệt độ nhựa,Đọc xung nhiệt độ nhựa,,,,,,,,,,,,,,,,
<BlockCommentCategoryData>,BTNN_VACM_V1_1_relay_dp4_AnSon\PLC_1 [CPU 1214C AC/DC/Rly]\Program blocks\C#6_WD_CALIB [DB6]\XUNG_TEMP_TS,,Đọc xung nhiệt độ tan sấy,Đọc xung nhiệt độ tan sấy,,,,,,,,,,,,,,,,
<BlockCommentCategoryData>,BTNN_VACM_V1_1_relay_dp4_AnSon\PLC_1 [CPU 1214C AC/DC/Rly]\Program blocks\C#6_WD_CALIB [DB6]\XUNG_TEMP_TL,,Đọc xung nhiệt độ túi lọc,Đọc xung nhiệt độ túi lọc,,,,,,,,,,,,,,,,
<BlockCommentCategoryData>,BTNN_VACM_V1_1_relay_dp4_AnSon\PLC_1 [CPU 1214C AC/DC/Rly]\Program blocks\C#6_WD_CALIB [DB6]\XUNG_SB1,,Đọc xung SB1,Đọc xung SB1,,,,,,,,,,,,,,,,
<BlockCommentCategoryData>,BTNN_VACM_V1_1_relay_dp4_AnSon\PLC_1 [CPU 1214C AC/DC/Rly]\Program blocks\7.WEIGHT_PROCESS [FB7]\Network 6\Network comment,,"EMTY_IN là tín hiệu báo cân đã empty, cân rỗng thì reset FU_OUT, reset chạy Tịnh THO, và bật luôn đầu ra EM_OUT","EMTY_IN là tín hiệu báo cân đã empty, cân rỗng thì reset FU_OUT, reset chạy Tịnh THO, và bật luôn đầu ra EM_OUT",,,,,,,,,,,,,,,,
<BlockCommentCategoryData>,BTNN_VACM_V1_1_relay_dp4_AnSon\PLC_1 [CPU 1214C AC/DC/Rly]\Program blocks\C#2_WB [DB2]\F1_NN_RUN,,F1 Nút nhấn chạy,F1 Nút nhấn chạy,,,,,,,,,,,,,,,,
<BlockCommentCategoryData>,BTNN_VACM_V1_1_relay_dp4_AnSon\PLC_1 [CPU 1214C AC/DC/Rly]\Program blocks\C#2_WB [DB2]\F2_SW_PAU,,F2 Công tắc tạm dừng,F2 Công tắc tạm dừng,,,,,,,,,,,,,,,,
<BlockCommentCategoryData>,BTNN_VACM_V1_1_relay_dp4_AnSon\PLC_1 [CPU 1214C AC/DC/Rly]\Program blocks\C#2_WB [DB2]\F3_NN_STOP,,F3 Nút nhấn dừng/hủy mẻ,F3 Nút nhấn dừng/hủy mẻ,,,,,,,,,,,,,,,,
<BlockCommentCategoryData>,BTNN_VACM_V1_1_relay_dp4_AnSon\PLC_1 [CPU 1214C AC/DC/Rly]\Program blocks\C#2_WB [DB2]\F4_SW_SIM,,F4 Công tắc chế độ mô phỏng,F4 Công tắc chế độ mô phỏng,,,,,,,,,,,,,,,,
<BlockCommentCategoryData>,BTNN_VACM_V1_1_relay_dp4_AnSon\PLC_1 [CPU 1214C AC/DC/Rly]\Program blocks\C#3_WD_SILO [DB3]\FD1_KL_RTD,,FD1 khối lượng rơi tự do,FD1 khối lượng rơi tự do,,,,,,,,,,,,,,,,
<BlockCommentCategoryData>,BTNN_VACM_V1_1_relay_dp4_AnSon\PLC_1 [CPU 1214C AC/DC/Rly]\Program blocks\C#3_WD_SILO [DB3]\FD1_SS_DUOI,,FD1 sai số dưới,FD1 sai số dưới,,,,,,,,,,,,,,,,
<BlockCommentCategoryData>,BTNN_VACM_V1_1_relay_dp4_AnSon\PLC_1 [CPU 1214C AC/DC/Rly]\Program blocks\C#3_WD_SILO [DB3]\FD1_SS_TREN,,FD1 sai số trên,FD1 sai số trên,,,,,,,,,,,,,,,,
<BlockCommentCategoryData>,BTNN_VACM_V1_1_relay_dp4_AnSon\PLC_1 [CPU 1214C AC/DC/Rly]\Program blocks\C#3_WD_SILO [DB3]\FD1_TG_OFF_CAN,,FD1 thời gian đóng cân,FD1 thời gian đóng cân,,,,,,,,,,,,,,,,
<BlockCommentCategoryData>,BTNN_VACM_V1_1_relay_dp4_AnSon\PLC_1 [CPU 1214C AC/DC/Rly]\Program blocks\C#3_WD_SILO [DB3]\FD1_TG_ON_CAN,,FD1 thời gian mở cân,FD1 thời gian mở cân,,,,,,,,,,,,,,,,
<BlockCommentCategoryData>,BTNN_VACM_V1_1_relay_dp4_AnSon\PLC_1 [CPU 1214C AC/DC/Rly]\Program blocks\C#3_WD_SILO [DB3]\FD1_TG_ODC,,FD1 thời gian tính lượng rơi thêm,FD1 thời gian tính lượng rơi thêm,,,,,,,,,,,,,,,,
<TagCommentCategoryData>,BTNN_VACM_V1_1_relay_dp4_AnSon\PLC_1 [CPU 1214C AC/DC/Rly]\PLC tags\Out_Put [83]\GAU COT LIEU\Comment,,Gàu tải cốt liệu nóng,Gàu tải cốt liệu nóng,,,,,,,,,,,,,,,,
<BlockCommentCategoryData>,BTNN_VACM_V1_1_relay_dp4_AnSon\PLC_1 [CPU 1214C AC/DC/Rly]\Program blocks\C#1_RB [DB1]\GAU COT LIEU,,Gàu tải cốt liệu nóng,Gàu tải cốt liệu nóng,,,,,,,,,,,,,,,,
<TagCommentCategoryData>,BTNN_VACM_V1_1_relay_dp4_AnSon\PLC_1 [CPU 1214C AC/DC/Rly]\PLC tags\Out_Put [83]\GAU FD\Comment,,Gàu tải phụ F/D,Gàu tải phụ F/D,,,,,,,,,,,,,,,,
<BlockCommentCategoryData>,BTNN_VACM_V1_1_relay_dp4_AnSon\PLC_1 [CPU 1214C AC/DC/Rly]\Program blocks\C#1_RB [DB1]\GAU FD,,Gàu tải phụ F/D,Gàu tải phụ F/D,,,,,,,,,,,,,,,,
<BlockCommentCategoryData>,BTNN_VACM_V1_1_relay_dp4_AnSon\PLC_1 [CPU 1214C AC/DC/Rly]\Program blocks\C#6_WD_CALIB [DB6]\HS_AG1,,Hệ số cân Ag1,Hệ số cân Ag1,,,,,,,,,,,,,,,,
<BlockCommentCategoryData>,BTNN_VACM_V1_1_relay_dp4_AnSon\PLC_1 [CPU 1214C AC/DC/Rly]\Program blocks\C#6_WD_CALIB [DB6]\HS_AP1,,Hệ số cân AP1,Hệ số cân AP1,,,,,,,,,,,,,,,,
<BlockCommentCategoryData>,BTNN_VACM_V1_1_relay_dp4_AnSon\PLC_1 [CPU 1214C AC/DC/Rly]\Program blocks\C#6_WD_CALIB [DB6]\HS_FD1,,Hệ số cân FD1,Hệ số cân FD1,,,,,,,,,,,,,,,,
<BlockCommentCategoryData>,BTNN_VACM_V1_1_relay_dp4_AnSon\PLC_1 [CPU 1214C AC/DC/Rly]\Program blocks\C#6_WD_CALIB [DB6]\HS_SB1,,Hệ số cân SB1,Hệ số cân SB1,,,,,,,,,,,,,,,,
<BlockCommentCategoryData>,BTNN_VACM_V1_1_relay_dp4_AnSon\PLC_1 [CPU 1214C AC/DC/Rly]\Program blocks\C#5_WD_TIMER [DB5]\HSN_AG1,,Hệ số nạp mô phỏng AG1,Hệ số nạp mô phỏng AG1,,,,,,,,,,,,,,,,
<BlockCommentCategoryData>,BTNN_VACM_V1_1_relay_dp4_AnSon\PLC_1 [CPU 1214C AC/DC/Rly]\Program blocks\C#5_WD_TIMER [DB5]\HSN_AG2,,Hệ số nạp mô phỏng AG2,Hệ số nạp mô phỏng AG2,,,,,,,,,,,,,,,,
<BlockCommentCategoryData>,BTNN_VACM_V1_1_relay_dp4_AnSon\PLC_1 [CPU 1214C AC/DC/Rly]\Program blocks\C#5_WD_TIMER [DB5]\HSN_AG3,,Hệ số nạp mô phỏng AG3,Hệ số nạp mô phỏng AG3,,,,,,,,,,,,,,,,
<BlockCommentCategoryData>,BTNN_VACM_V1_1_relay_dp4_AnSon\PLC_1 [CPU 1214C AC/DC/Rly]\Program blocks\C#5_WD_TIMER [DB5]\HSN_AG4,,Hệ số nạp mô phỏng AG4,Hệ số nạp mô phỏng AG4,,,,,,,,,,,,,,,,
<BlockCommentCategoryData>,BTNN_VACM_V1_1_relay_dp4_AnSon\PLC_1 [CPU 1214C AC/DC/Rly]\Program blocks\C#5_WD_TIMER [DB5]\HSN_AG5,,Hệ số nạp mô phỏng AG5,Hệ số nạp mô phỏng AG5,,,,,,,,,,,,,,,,
<BlockCommentCategoryData>,BTNN_VACM_V1_1_relay_dp4_AnSon\PLC_1 [CPU 1214C AC/DC/Rly]\Program blocks\C#5_WD_TIMER [DB5]\HSN_AP1,,Hệ số nạp mô phỏng AP1,Hệ số nạp mô phỏng AP1,,,,,,,,,,,,,,,,
<BlockCommentCategoryData>,BTNN_VACM_V1_1_relay_dp4_AnSon\PLC_1 [CPU 1214C AC/DC/Rly]\Program blocks\C#5_WD_TIMER [DB5]\HSN_FD1,,Hệ số nạp mô phỏng FD1,Hệ số nạp mô phỏng FD1,,,,,,,,,,,,,,,,
<BlockCommentCategoryData>,BTNN_VACM_V1_1_relay_dp4_AnSon\PLC_1 [CPU 1214C AC/DC/Rly]\Program blocks\C#5_WD_TIMER [DB5]\HSN_SB1,,Hệ số nạp mô phỏng SBS1,Hệ số nạp mô phỏng SBS1,,,,,,,,,,,,,,,,
<BlockCommentCategoryData>,BTNN_VACM_V1_1_relay_dp4_AnSon\PLC_1 [CPU 1214C AC/DC/Rly]\Program blocks\C#6_WD_CALIB [DB6]\HS_TEMP TS,,Hệ số nhiệt độ 1,Hệ số nhiệt độ 1,,,,,,,,,,,,,,,,
<BlockCommentCategoryData>,BTNN_VACM_V1_1_relay_dp4_AnSon\PLC_1 [CPU 1214C AC/DC/Rly]\Program blocks\C#6_WD_CALIB [DB6]\HS_TEMP AG,,Hệ số nhiệt độ 2,Hệ số nhiệt độ 2,,,,,,,,,,,,,,,,
<BlockCommentCategoryData>,BTNN_VACM_V1_1_relay_dp4_AnSon\PLC_1 [CPU 1214C AC/DC/Rly]\Program blocks\C#6_WD_CALIB [DB6]\HS_TEMP AP,,Hệ số nhiệt độ 3,Hệ số nhiệt độ 3,,,,,,,,,,,,,,,,
<BlockCommentCategoryData>,BTNN_VACM_V1_1_relay_dp4_AnSon\PLC_1 [CPU 1214C AC/DC/Rly]\Program blocks\C#6_WD_CALIB [DB6]\HS_TEMP TL,,Hệ số nhiệt độ 4,Hệ số nhiệt độ 4,,,,,,,,,,,,,,,,
<BlockCommentCategoryData>,BTNN_VACM_V1_1_relay_dp4_AnSon\PLC_1 [CPU 1214C AC/DC/Rly]\Program blocks\C#5_WD_TIMER [DB5]\HSX_AG1,,Hệ số xả mô phỏng AG1,Hệ số xả mô phỏng AG1,,,,,,,,,,,,,,,,
<BlockCommentCategoryData>,BTNN_VACM_V1_1_relay_dp4_AnSon\PLC_1 [CPU 1214C AC/DC/Rly]\Program blocks\C#5_WD_TIMER [DB5]\HSX_AP1,,Hệ số xả mô phỏng AP1,Hệ số xả mô phỏng AP1,,,,,,,,,,,,,,,,
<BlockCommentCategoryData>,BTNN_VACM_V1_1_relay_dp4_AnSon\PLC_1 [CPU 1214C AC/DC/Rly]\Program blocks\C#5_WD_TIMER [DB5]\HSX_FD1,,Hệ số xả mô phỏng FD1,Hệ số xả mô phỏng FD1,,,,,,,,,,,,,,,,
<BlockCommentCategoryData>,BTNN_VACM_V1_1_relay_dp4_AnSon\PLC_1 [CPU 1214C AC/DC/Rly]\Program blocks\C#5_WD_TIMER [DB5]\HSX_SB1,,Hệ số xả mô phỏng SBS1,Hệ số xả mô phỏng SBS1,,,,,,,,,,,,,,,,
<BlockCommentCategoryData>,BTNN_VACM_V1_1_relay_dp4_AnSon\PLC_1 [CPU 1214C AC/DC/Rly]\Program blocks\7.WEIGHT_PROCESS [FB7]\TEMP_T/T,,Hết thời gian đóng cân ==> mở cân,Hết thời gian đóng cân ==> mở cân,,,,,,,,,,,,,,,,
<TagCommentCategoryData>,BTNN_VACM_V1_1_relay_dp4_AnSon\PLC_1 [CPU 1214C AC/DC/Rly]\PLC tags\In_Put [40]\I_TH. CUA DONG\Comment,,Input_Tín hiệu  cửa nồi trộn đóng,Input_Tín hiệu  cửa nồi trộn đóng,,,,,,,,,,,,,,,,
<TagCommentCategoryData>,BTNN_VACM_V1_1_relay_dp4_AnSon\PLC_1 [CPU 1214C AC/DC/Rly]\PLC tags\In_Put [40]\I_TH. BTN\Comment,,Input_Tín hiệu băng tải ngang,Input_Tín hiệu băng tải ngang,,,,,,,,,,,,,,,,
<TagCommentCategoryData>,BTNN_VACM_V1_1_relay_dp4_AnSon\PLC_1 [CPU 1214C AC/DC/Rly]\PLC tags\In_Put [40]\I_TH. BTX\Comment,,Input_Tín hiệu băng tải xiên,Input_Tín hiệu băng tải xiên,,,,,,,,,,,,,,,,
<TagCommentCategoryData>,BTNN_VACM_V1_1_relay_dp4_AnSon\PLC_1 [CPU 1214C AC/DC/Rly]\PLC tags\In_Put [40]\I_TH. SILO FD HIGHT\Comment,,Input_Tín hiệu báo mức cao silo chứa F/D,Input_Tín hiệu báo mức cao silo chứa F/D,,,,,,,,,,,,,,,,
<TagCommentCategoryData>,BTNN_VACM_V1_1_relay_dp4_AnSon\PLC_1 [CPU 1214C AC/DC/Rly]\PLC tags\In_Put [40]\I_TH. SILO FD LOW\Comment,,Input_Tín hiệu báo mức thấp silo chứa F/D,Input_Tín hiệu báo mức thấp silo chứa F/D,,,,,,,,,,,,,,,,
<TagCommentCategoryData>,BTNN_VACM_V1_1_relay_dp4_AnSon\PLC_1 [CPU 1214C AC/DC/Rly]\PLC tags\In_Put [40]\I_TH. TRAN AG1\Comment,,Input_Tín hiệu báo tràn silo AG1,Input_Tín hiệu báo tràn silo AG1,,,,,,,,,,,,,,,,
<TagCommentCategoryData>,BTNN_VACM_V1_1_relay_dp4_AnSon\PLC_1 [CPU 1214C AC/DC/Rly]\PLC tags\In_Put [40]\I_TH. TRAN AG2\Comment,,Input_Tín hiệu báo tràn silo AG2,Input_Tín hiệu báo tràn silo AG2,,,,,,,,,,,,,,,,
<TagCommentCategoryData>,BTNN_VACM_V1_1_relay_dp4_AnSon\PLC_1 [CPU 1214C AC/DC/Rly]\PLC tags\In_Put [40]\I_TH. TRAN AG3\Comment,,Input_Tín hiệu báo tràn silo AG3,Input_Tín hiệu báo tràn silo AG3,,,,,,,,,,,,,,,,
<TagCommentCategoryData>,BTNN_VACM_V1_1_relay_dp4_AnSon\PLC_1 [CPU 1214C AC/DC/Rly]\PLC tags\In_Put [40]\I_TH. TRAN AG4\Comment,,Input_Tín hiệu báo tràn silo AG4,Input_Tín hiệu báo tràn silo AG4,,,,,,,,,,,,,,,,
<TagCommentCategoryData>,BTNN_VACM_V1_1_relay_dp4_AnSon\PLC_1 [CPU 1214C AC/DC/Rly]\PLC tags\In_Put [40]\I_TH. TRAN AG5\Comment,,Input_Tín hiệu báo tràn silo AG5,Input_Tín hiệu báo tràn silo AG5,,,,,,,,,,,,,,,,
<TagCommentCategoryData>,BTNN_VACM_V1_1_relay_dp4_AnSon\PLC_1 [CPU 1214C AC/DC/Rly]\PLC tags\In_Put [40]\I_TH. TRAN FD1\Comment,,Input_Tín hiệu báo tràn silo F/D,Input_Tín hiệu báo tràn silo F/D,,,,,,,,,,,,,,,,
<TagCommentCategoryData>,BTNN_VACM_V1_1_relay_dp4_AnSon\PLC_1 [CPU 1214C AC/DC/Rly]\PLC tags\In_Put [40]\I_TH. TRAN SB1\Comment,,Input_Tín hiệu báo tràn silo SBS,Input_Tín hiệu báo tràn silo SBS,,,,,,,,,,,,,,,,
<TagCommentCategoryData>,BTNN_VACM_V1_1_relay_dp4_AnSon\PLC_1 [CPU 1214C AC/DC/Rly]\PLC tags\In_Put [40]\I_TH. CUA MO\Comment,,Input_Tín hiệu cửa nồi trộn mở,Input_Tín hiệu cửa nồi trộn mở,,,,,,,,,,,,,,,,
<TagCommentCategoryData>,BTNN_VACM_V1_1_relay_dp4_AnSon\PLC_1 [CPU 1214C AC/DC/Rly]\PLC tags\In_Put [40]\I_TH. GAU COT LIEU\Comment,,Input_Tín hiệu gàu tải cốt liệu nóng,Input_Tín hiệu gàu tải cốt liệu nóng,,,,,,,,,,,,,,,,
<TagCommentCategoryData>,BTNN_VACM_V1_1_relay_dp4_AnSon\PLC_1 [CPU 1214C AC/DC/Rly]\PLC tags\In_Put [40]\I_TH. GAU F/D\Comment,,Input_Tín hiệu gàu tải phụ gia bột,Input_Tín hiệu gàu tải phụ gia bột,,,,,,,,,,,,,,,,
<TagCommentCategoryData>,BTNN_VACM_V1_1_relay_dp4_AnSon\PLC_1 [CPU 1214C AC/DC/Rly]\PLC tags\In_Put [40]\I_TH. MNK\Comment,,Input_Tín hiệu máy nén khí chạy,Input_Tín hiệu máy nén khí chạy,,,,,,,,,,,,,,,,
<TagCommentCategoryData>,BTNN_VACM_V1_1_relay_dp4_AnSon\PLC_1 [CPU 1214C AC/DC/Rly]\PLC tags\In_Put [40]\I_TH. NOI TRON\Comment,,Input_Tín hiệu nồi trộn,Input_Tín hiệu nồi trộn,,,,,,,,,,,,,,,,
<TagCommentCategoryData>,BTNN_VACM_V1_1_relay_dp4_AnSon\PLC_1 [CPU 1214C AC/DC/Rly]\PLC tags\In_Put [40]\I_TH. SANG RUNG\Comment,,Input_Tín hiệu sàng rung cốt liệu nóng,Input_Tín hiệu sàng rung cốt liệu nóng,,,,,,,,,,,,,,,,
<TagCommentCategoryData>,BTNN_VACM_V1_1_relay_dp4_AnSon\PLC_1 [CPU 1214C AC/DC/Rly]\PLC tags\In_Put [40]\I_TH. TANG SAY\Comment,,Input_Tín hiệu tang sấy cốt liệu,Input_Tín hiệu tang sấy cốt liệu,,,,,,,,,,,,,,,,
<BlockCommentCategoryData>,BTNN_VACM_V1_1_relay_dp4_AnSon\PLC_1 [CPU 1214C AC/DC/Rly]\Program blocks\7.WEIGHT_PROCESS [FB7]\Network 7\Network comment,,"Khi khối lượng đầu vào vượt qua sai số dưới, thì bắt đầu đếm để tình thời gian Delay trước khi báo FU
nếu thời gian đếm nó vượt qua giá trị cài đặt (cũng chính là thời gian đợi chơ lượng rơi thêm), thì SET ngõ ra #FU_OUT

Chú ý: chế độ MAN thì nó không báo FU
Cân FULL khi giá trị cân nó vượt qua SS_DUOI rồi đợi thêm một khoảng thời gian rơi thêm","Khi khối lượng đầu vào vượt qua sai số dưới, thì bắt đầu đếm để tình thời gian Delay trước khi báo FU
nếu thời gian đếm nó vượt qua giá trị cài đặt (cũng chính là thời gian đợi chơ lượng rơi thêm), thì SET ngõ ra #FU_OUT

Chú ý: chế độ MAN thì nó không báo FU
Cân FULL khi giá trị cân nó vượt qua SS_DUOI rồi đợi thêm một khoảng thời gian rơi thêm",,,,,,,,,,,,,,,,
<BlockCommentCategoryData>,BTNN_VACM_V1_1_relay_dp4_AnSon\PLC_1 [CPU 1214C AC/DC/Rly]\Program blocks\7.WEIGHT_PROCESS [FB7]\W_RTD,,Khối lựng rơi tự do,Khối lựng rơi tự do,,,,,,,,,,,,,,,,
